Organization,Category,Mission/Goals,Service Area (Region),County,Also Serving,Region,Website,Contact Person,Email,Phone
Energize - ECI (East Central Indiana)-A (Rush),Regional Economic Development Organization,"Formed in 2005, Energize-ECI, Inc. is a pro-active private-public partnership with a mission to market the assets and resources of the 10-county East Central Indiana (ECI) region and to team with local economic development organizations (LEDOs) and the Indiana Economic Development Corporation to bring capital investment and new jobs to the region and to assist existing ECI businesses grow and prosper. ","Blackford, Delaware, Fayette, Grant, Henry, Jay, Madison, Randolph, and Rush counties.",Rush,"Blackford, Fayette, Grant, Henry, Jay, Madison, Randolph, Rush",6,www.Energize-ECI.org,Mindy Kenworthy,Not Readily Available,765.254.1420
Northeast Indiana Regional Partnership (Allen),Regional Economic Development Organization,Mission: To attract new business investment by generating business leads and building regional capacity through product development and effective regional collaboration. Vision: The Partnership is one of the top performing regional economic development organizations in the nation.,"Adams, Allen, DeKalb, Huntington, LaGrange, Noble, Steuben, Wabash, Wells, and Whitley counties.",Allen,"Adams, DeKalb, Huntington, LaGrange, Noble, Steuben, Wabash, Wells, Whitley",3,www.NEIndiana.com,John Sampson,Not Readily Available,260.469.3469
Northeast Indiana Regional Partnership (Adams),Regional Economic Development Organization,Mission: To attract new business investment by generating business leads and building regional capacity through product development and effective regional collaboration. Vision: The Partnership is one of the top performing regional economic development organizations in the nation.,"Adams, Allen, DeKalb, Huntington, LaGrange, Noble, Steuben, Wabash, Wells, and Whitley counties.",Adams,"Adams, DeKalb, Huntington, LaGrange, Noble, Steuben, Wabash, Wells, Whitley",3,www.NEIndiana.com,John Sampson,Not Readily Available,260.469.3469
Northeast Indiana Regional Partnership (DeKalb),Regional Economic Development Organization,Mission: To attract new business investment by generating business leads and building regional capacity through product development and effective regional collaboration. Vision: The Partnership is one of the top performing regional economic development organizations in the nation.,"Adams, Allen, DeKalb, Huntington, LaGrange, Noble, Steuben, Wabash, Wells, and Whitley counties.",DeKalb,"Adams, DeKalb, Huntington, LaGrange, Noble, Steuben, Wabash, Wells, Whitley",3,www.NEIndiana.com,John Sampson,Not Readily Available,260.469.3469
Northeast Indiana Regional Partnership (Huntington),Regional Economic Development Organization,Mission: To attract new business investment by generating business leads and building regional capacity through product development and effective regional collaboration. Vision: The Partnership is one of the top performing regional economic development organizations in the nation.,"Adams, Allen, DeKalb, Huntington, LaGrange, Noble, Steuben, Wabash, Wells, and Whitley counties.",Huntington,"Adams, DeKalb, Huntington, LaGrange, Noble, Steuben, Wabash, Wells, Whitley",3,www.NEIndiana.com,John Sampson,Not Readily Available,260.469.3469
Northeast Indiana Regional Partnership (LaGrange),Regional Economic Development Organization,Mission: To attract new business investment by generating business leads and building regional capacity through product development and effective regional collaboration. Vision: The Partnership is one of the top performing regional economic development organizations in the nation.,"Adams, Allen, DeKalb, Huntington, LaGrange, Noble, Steuben, Wabash, Wells, and Whitley counties.",LaGrange,"Adams, DeKalb, Huntington, LaGrange, Noble, Steuben, Wabash, Wells, Whitley",3,www.NEIndiana.com,John Sampson,Not Readily Available,260.469.3469
Northeast Indiana Regional Partnership (Noble),Regional Economic Development Organization,Mission: To attract new business investment by generating business leads and building regional capacity through product development and effective regional collaboration. Vision: The Partnership is one of the top performing regional economic development organizations in the nation.,"Adams, Allen, DeKalb, Huntington, LaGrange, Noble, Steuben, Wabash, Wells, and Whitley counties.",Noble,"Adams, DeKalb, Huntington, LaGrange, Noble, Steuben, Wabash, Wells, Whitley",3,www.NEIndiana.com,John Sampson,Not Readily Available,260.469.3469
Northeast Indiana Regional Partnership (Steuben),Regional Economic Development Organization,Mission: To attract new business investment by generating business leads and building regional capacity through product development and effective regional collaboration. Vision: The Partnership is one of the top performing regional economic development organizations in the nation.,"Adams, Allen, DeKalb, Huntington, LaGrange, Noble, Steuben, Wabash, Wells, and Whitley counties.",Steuben,"Adams, DeKalb, Huntington, LaGrange, Noble, Steuben, Wabash, Wells, Whitley",3,www.NEIndiana.com,John Sampson,Not Readily Available,260.469.3469
Northeast Indiana Regional Partnership (Wabash),Regional Economic Development Organization,Mission: To attract new business investment by generating business leads and building regional capacity through product development and effective regional collaboration. Vision: The Partnership is one of the top performing regional economic development organizations in the nation.,"Adams, Allen, DeKalb, Huntington, LaGrange, Noble, Steuben, Wabash, Wells, and Whitley counties.",Wabash,"Adams, DeKalb, Huntington, LaGrange, Noble, Steuben, Wabash, Wells, Whitley",3,www.NEIndiana.com,John Sampson,Not Readily Available,260.469.3469
Northeast Indiana Regional Partnership (Wells),Regional Economic Development Organization,Mission: To attract new business investment by generating business leads and building regional capacity through product development and effective regional collaboration. Vision: The Partnership is one of the top performing regional economic development organizations in the nation.,"Adams, Allen, DeKalb, Huntington, LaGrange, Noble, Steuben, Wabash, Wells, and Whitley counties.",Wells,"Adams, DeKalb, Huntington, LaGrange, Noble, Steuben, Wabash, Wells, Whitley",3,www.NEIndiana.com,John Sampson,Not Readily Available,260.469.3469
Northeast Indiana Regional Partnership (Whitley),Regional Economic Development Organization,Mission: To attract new business investment by generating business leads and building regional capacity through product development and effective regional collaboration. Vision: The Partnership is one of the top performing regional economic development organizations in the nation.,"Adams, Allen, DeKalb, Huntington, LaGrange, Noble, Steuben, Wabash, Wells, and Whitley counties.",Whitley,"Adams, DeKalb, Huntington, LaGrange, Noble, Steuben, Wabash, Wells, Whitley",3,www.NEIndiana.com,John Sampson,Not Readily Available,260.469.3469
Benton County Economic Development Board,Local Economic Development Organization,"Growing Together, Reaching New Heights",Benton County,Benton,n/a,4,http://www.benton4biz.com/,Kelly Kepner,kkepner@bentoncounty.in.gov,765.884.2080
Carroll County Economic Development Corporation,Local Economic Development Organization,"Mission: The Carroll County Economic Development Corporation will be a pro-active leader 
in aunified pursuit to provide a dynamic and prosperous economy for the citizens 
and employers of Carroll County. ",Carroll County,Carroll,n/a,4,www.carrollcountyedc.com,Laura Walls,lwalls@carrollcountyedc.com,765.564.2060
Cass County Economic Development,Local Economic Development Organization,Not readily available.,Cass County,Cass,n/a,4,www.casscountyed.co.cass.in.us,Christy Householder,christy.householder@co.cass.in.us,574.732.2590
Clinton County Economic Development,Local Economic Development Organization,"Founded in 1914 as the Frankfort Industrial Association, the future of the current Clinton County Economic Development was quietly born.  As a result of that birth, the Economic Development program has evolved into an extension of the Clinton County Chamber of Commerce.  During this evolution, the creation of Partners in Progress came along side the Chamber and Economic Development and the results are over 200 million dollars invested in industry, infrastructure, and community since the year 2000.",Clinton County,Clinton,n/a,4,www.ccinchamber.org/economic-development,Shan Sheridan,shan@ccinchamber.org,765.654.5507
Fountain County Chamber of Commerce,Local Economic Development Organization,Not readily available.,Fountain County,Fountain,n/a,4,-,Don Hesler,dfhesler@sbcglobal.net,765.366.2817
Greater Kokomo Economic Development Alliance,Local Economic Development Organization,To provide the environment that will enable a more strategic and long-view strategy in making decisions to further grow and develop our community to meet the needs of the new economy. ,Howard County,Howard,n/a,4,www.greaterkokomo.com,Charlie Sparks,csparks@greaterkokomo.com,765.457.2000
Miami County Economic Development Authority,Local Economic Development Organization,"MCEDA is a unique partnership of private enterprise and government working as one for the prosperity of North Central Indiana. Our purpose is to coordinate local efforts to attract jobs and new business investment, provide assistance toexisting businesses to foster growth and retention, and assist in efforts to sustain and improve the quality of life for Miami County citizens.",Miami County,Miami,n/a,4,www.miamicountyeda.com,Jim Tidd,jtidd@miamicountyeda.com,765.689.0159
Montgomery County Economic Development,Local Economic Development Organization,"The basic mission of the Montgomery County Economic Development, Inc. is to serve as an active leader in the advancement of the economic health of Montgomery County, by serving as the focal point for business and industry growth, job retention, workforce development and economic development education that will result in a greater quality of life for the Montgomery County community.",Montgomery County,Montgomery,n/a,4,www.mcedinc.com,Kristin Clary,kristinclary@MCEDinc.com,765.362.6851
Greater Lafayette Commerce,Local Economic Development Organization,"GLC and its Economic Development Council are centered on seven strategies in their mission to enhance the Greater Lafayette region:1Create an environment conducive to growing technology and advanced manufacturing businesses.2Attract new business and industry.3Support the expansion and retention of major employers.4Develop new small businesses, while aiding in the expansion and retention of existing small- to medium-size businesses.5Forge partnerships with business, government and educational authorities, and encourage the community’s public and private sectors to invest in Greater Lafayette’s economic development.6Support the changing cultural diversity and quality-of-life needs of the community.7Professionally manage the GLC organization so as to maintain its financial stability, meet the expectations of its members and treat its employees in a professional manner.",Tippecanoe County,Tippecanoe,n/a,4,www.greaterlafayettecommerce.com,Jody Hamilton,jhamilton@greaterlafayettecommerce.com,765.742.4044
Tipton County Economic Development Corporation,Local Economic Development Organization,Not readily available.,Tipton County,Tipton,n/a,4,www.tiptoncountyusa.com,D. Jeffrey Sheridan,director@tiptonedo.org,765.675.7418
Warren County Local Economic Development Organization,Local Economic Development Organization,"Warren County LEDO lends support to established companies by providing information and support relative to workforce training. LEDO also supports local, state, and federal initiatives for expansion of employment and technology enhancement.",Warren County,Warren,n/a,4,www.warrenadvantage.com,Steve Eberly,ledo@warrenadvantage.com,765.762.6055
White County Economic Development Organization,Local Economic Development Organization,The mission of the White County Economic Development Organization is to enhance the economy of White County by facilitating the growth and development of business and industry.,White County,White,n/a,4,www.whitecountyin.org,Randy Mitchell,rmitchell@whiced.com,574.583.6557
Indiana's Technology Corridor (Benton),Regional Economic Development Organization,"Amazing things happen in places where the education and business communities join forces. The global economy has been propelled by areas like Silicon Valley, where radically new concepts are transformed into practical everyday uses. That’s what you’ll find in Indiana’s Technology Corridor. Centered upon the advanced technology being created in labs at Purdue University and Indiana University, powered by highly skilled training from Ivy Tech Community College, and inspired by a long tradition of individual initiative, this region is shaping the nation’s future.","Benton, Carroll, Cass, Fountain, Montgomery, Pulaski, Tippecanoe, Warren, and White counties.",Benton,n/a,4,www.IndianasTechnologyCorridor.com,Steve Eberly,Not Readily Available,765.762.6055
Indiana's Technology Corridor (Carroll),Regional Economic Development Organization,"Amazing things happen in places where the education and business communities join forces. The global economy has been propelled by areas like Silicon Valley, where radically new concepts are transformed into practical everyday uses. That’s what you’ll find in Indiana’s Technology Corridor. Centered upon the advanced technology being created in labs at Purdue University and Indiana University, powered by highly skilled training from Ivy Tech Community College, and inspired by a long tradition of individual initiative, this region is shaping the nation’s future.","Benton, Carroll, Cass, Fountain, Montgomery, Pulaski, Tippecanoe, Warren, and White counties.",Carroll,n/a,4,www.IndianasTechnologyCorridor.com,Steve Eberly,Not Readily Available,765.762.6055
Indiana's Technology Corridor (Cass),Regional Economic Development Organization,"Amazing things happen in places where the education and business communities join forces. The global economy has been propelled by areas like Silicon Valley, where radically new concepts are transformed into practical everyday uses. That’s what you’ll find in Indiana’s Technology Corridor. Centered upon the advanced technology being created in labs at Purdue University and Indiana University, powered by highly skilled training from Ivy Tech Community College, and inspired by a long tradition of individual initiative, this region is shaping the nation’s future.","Benton, Carroll, Cass, Fountain, Montgomery, Pulaski, Tippecanoe, Warren, and White counties.",Cass,n/a,4,www.IndianasTechnologyCorridor.com,Steve Eberly,Not Readily Available,765.762.6055
Indiana's Technology Corridor (Fountain),Regional Economic Development Organization,"Amazing things happen in places where the education and business communities join forces. The global economy has been propelled by areas like Silicon Valley, where radically new concepts are transformed into practical everyday uses. That’s what you’ll find in Indiana’s Technology Corridor. Centered upon the advanced technology being created in labs at Purdue University and Indiana University, powered by highly skilled training from Ivy Tech Community College, and inspired by a long tradition of individual initiative, this region is shaping the nation’s future.","Benton, Carroll, Cass, Fountain, Montgomery, Pulaski, Tippecanoe, Warren, and White counties.",Fountain,n/a,4,www.IndianasTechnologyCorridor.com,Steve Eberly,Not Readily Available,765.762.6055
Indiana's Technology Corridor (Montgomery),Regional Economic Development Organization,"Amazing things happen in places where the education and business communities join forces. The global economy has been propelled by areas like Silicon Valley, where radically new concepts are transformed into practical everyday uses. That’s what you’ll find in Indiana’s Technology Corridor. Centered upon the advanced technology being created in labs at Purdue University and Indiana University, powered by highly skilled training from Ivy Tech Community College, and inspired by a long tradition of individual initiative, this region is shaping the nation’s future.","Benton, Carroll, Cass, Fountain, Montgomery, Pulaski, Tippecanoe, Warren, and White counties.",Montgomery,n/a,4,www.IndianasTechnologyCorridor.com,Steve Eberly,Not Readily Available,765.762.6055
Indiana's Technology Corridor (Pulaski),Regional Economic Development Organization,"Amazing things happen in places where the education and business communities join forces. The global economy has been propelled by areas like Silicon Valley, where radically new concepts are transformed into practical everyday uses. That’s what you’ll find in Indiana’s Technology Corridor. Centered upon the advanced technology being created in labs at Purdue University and Indiana University, powered by highly skilled training from Ivy Tech Community College, and inspired by a long tradition of individual initiative, this region is shaping the nation’s future.","Benton, Carroll, Cass, Fountain, Montgomery, Pulaski, Tippecanoe, Warren, and White counties.",Pulaski,n/a,1,www.IndianasTechnologyCorridor.com,Steve Eberly,Not Readily Available,765.762.6055
Indiana's Technology Corridor (Tippecanoe),Regional Economic Development Organization,"Amazing things happen in places where the education and business communities join forces. The global economy has been propelled by areas like Silicon Valley, where radically new concepts are transformed into practical everyday uses. That’s what you’ll find in Indiana’s Technology Corridor. Centered upon the advanced technology being created in labs at Purdue University and Indiana University, powered by highly skilled training from Ivy Tech Community College, and inspired by a long tradition of individual initiative, this region is shaping the nation’s future.","Benton, Carroll, Cass, Fountain, Montgomery, Pulaski, Tippecanoe, Warren, and White counties.",Tippecanoe,n/a,4,www.IndianasTechnologyCorridor.com,Steve Eberly,Not Readily Available,765.762.6055
Indiana's Technology Corridor (Warren),Regional Economic Development Organization,"Amazing things happen in places where the education and business communities join forces. The global economy has been propelled by areas like Silicon Valley, where radically new concepts are transformed into practical everyday uses. That’s what you’ll find in Indiana’s Technology Corridor. Centered upon the advanced technology being created in labs at Purdue University and Indiana University, powered by highly skilled training from Ivy Tech Community College, and inspired by a long tradition of individual initiative, this region is shaping the nation’s future.","Benton, Carroll, Cass, Fountain, Montgomery, Pulaski, Tippecanoe, Warren, and White counties.",Warren,n/a,4,www.IndianasTechnologyCorridor.com,Steve Eberly,Not Readily Available,765.762.6055
Indiana's Technology Corridor (White),Regional Economic Development Organization,"Amazing things happen in places where the education and business communities join forces. The global economy has been propelled by areas like Silicon Valley, where radically new concepts are transformed into practical everyday uses. That’s what you’ll find in Indiana’s Technology Corridor. Centered upon the advanced technology being created in labs at Purdue University and Indiana University, powered by highly skilled training from Ivy Tech Community College, and inspired by a long tradition of individual initiative, this region is shaping the nation’s future.","Benton, Carroll, Cass, Fountain, Montgomery, Pulaski, Tippecanoe, Warren, and White counties.",White,n/a,4,www.IndianasTechnologyCorridor.com,Steve Eberly,Not Readily Available,765.762.6055
Boone County Economic Development Corporation,Local Economic Development Organization,Not readily available.,Boone County,Boone,n/a,5,www.booneedc.org,Molly Whitehead,mwhitehead@booneedc.org,765.719.5268
Hamilton County Alliance,Local Economic Development Organization,The Hamilton County Economic Development Corporation acts to enhance the county’s economic health and quality of life by attracting and retaining businesses that will create a strong tax base through the provision of high quality jobs and capital investment.,Hamilton County,Hamilton,n/a,5,www.investhamiltoncounty.com,Tim Monger,tim.monger@investhamiltoncounty.com,317.345.4053
Hancock Economic Development Council,Local Economic Development Organization,"The Hancock Economic Development Council provides site location assistance, cost of doing business analysis, and economic impact modeling to site location consultants, the corporate real estate community, and individual businesses. We also serve as a liaison between local government and the business community. Local government is represented nationally and internationally through aggressive marketing and relationship management programs. The mission of the Hancock Economic Development Council is to “enhance the quality of life in Hancock County through the attraction and retention of quality jobs and promoting a diversified tax base.”",Hancock County,Hancock,n/a,5,www.hancockedc.com,"Nolan ""Skip"" Kuker",skuker@hancockedc.com,317.477.7241
Hendricks County Economic Development Partnership,Local Economic Development Organization,"Mission: To compete effectively for quality economic development throughout Hendricks County by providing unified, proactive public/private leadership.",Hendricks County,Hendricks,n/a,5,www.hcedp.org,Cinda Kelley,Kelley@hcedp.org,317.745.2400
Johnson County Development Corporation,Local Economic Development Organization,"JCDC’s mission is to reach globally to enhance the county’s quality of life, standard of living, and tax base by developing a diversified and high income employment environment, and creating new capital investment opportunities through the retention and expansion of our existing marketplace and the attraction of new companies to our county.",Johnson County,Johnson,n/a,5,www.jcdc.org,Cheryl Morphew,cmorphew@jcdc.org,317.736.4300
Corporation for Economic Development,Local Economic Development Organization,"The mission of the Corporation for Economic Development (CED) is to plan and undertake activities leading to steady job growth, increasing economic diversity, and a strengthened employer base which enhance the quality of life of Madison County.",Madison County,Madison,n/a,5,www.cedanderson.com,Rob Sparks,robsparks@cedanderson.com,765.642.1860
Develop Indy,Local Economic Development Organization,"The Indy Chamber serves as a voice of progress and improvement in the region, uniting business and community to maintain a strong economy and quality of life. Our advocacy efforts, networking events, economic development initiatives, and other member benefits  position members, business leaders and the community for success.",Marion County,Marion,n/a,12,www.developindy.com,Brian Gildea,bgildea@indychamber.com,317.808.3257
Morgan County Economic Development Corporation,Local Economic Development Organization,Our mission: New jobs. Capital Investment.,Morgan County,Morgan,n/a,5,www.morgancoed.com,Chelsey Manns,cmanns@morgancoed.com,317.831.9544
Shelby County Economic Development Corporation,Local Economic Development Organization,Not readily available.,Shelby County,Shelby,n/a,5,www.shelbydevelopment.com,Dan Theobald,d.theobald@shelbydevelopment.com,317.398.8903
Energize - ECI (East Central Indiana)-B (Delaware),Regional Economic Development Organization,"Formed in 2005, Energize-ECI, Inc. is a pro-active private-public partnership with a mission to market the assets and resources of the 10-county East Central Indiana (ECI) region and to team with local economic development organizations (LEDOs) and the Indiana Economic Development Corporation to bring capital investment and new jobs to the region and to assist existing ECI businesses grow and prosper. ","Blackford, Delaware, Fayette, Grant, Henry, Jay, Madison, Randolph, and Rush counties.",Delaware,"Blackford, Fayette, Grant, Henry, Jay, Madison, Randolph, Rush",6,www.Energize-ECI.org,Mindy Kenworthy,Not Readily Available,765.254.1420
Energize - ECI (East Central Indiana)-B (Blackford),Regional Economic Development Organization,"Formed in 2005, Energize-ECI, Inc. is a pro-active private-public partnership with a mission to market the assets and resources of the 10-county East Central Indiana (ECI) region and to team with local economic development organizations (LEDOs) and the Indiana Economic Development Corporation to bring capital investment and new jobs to the region and to assist existing ECI businesses grow and prosper. ","Blackford, Delaware, Fayette, Grant, Henry, Jay, Madison, Randolph, and Rush counties.",Blackford,"Blackford, Fayette, Grant, Henry, Jay, Madison, Randolph, Rush",6,www.Energize-ECI.org,Mindy Kenworthy,Not Readily Available,765.254.1420
